{
  "$schema": "https://patrickfust.github.io/provenance/v2/provenance-schema.json",
  "provenanceTitle": "The provenance title in a JSON file",
  "databaseName": "The database name",
  "schemaName": "xxx",
  "tables": [
    {
      "name": "something",
      "createTableScript": "myscript.sql",
      "fields": [
        {
          "name": "name",
          "comment": "some comment",
          "dataType": "bigint"
        }
      ]
    },
    {
      "name": "table_a",
      "createTableScript": "create_table_a.sql",
      "fields": [
        {
          "name": "field_a",
          "dataType": "int",
          "foreignKey": {
            "tableName": "table_b",
            "columnName": "field_b"
          }
        }
      ]
    },
    {
      "name": "table_b",
      "fields": [
        {
          "name": "field_b",
          "dataType": "int"
        }
      ]
    }
  ]
}
